{
  "strategy_id": "STRAT_CONCESSION_DISCIPLINE",
  "revision": 1,
  "name": "Concession discipline (trade, don\u2019t give)",
  "category": "VALUE_CLAIM",
  "subcategories": [],
  "tags": [
    "CONCESSIONS",
    "TRADEOFFS",
    "EMAIL",
    "DM"
  ],
  "summary": "Ensure every concession is exchanged for something of value and logged in the concession ledger to prevent gradual squeeze.",
  "goal": "Protect your outcome by making concessions conditional and reciprocal.",
  "counterparty_guidance": [
    "Insist on reciprocity for any movement; no free concessions.",
    "Slow the pace of concessions and link each to a clear trade.",
    "If they will not trade, pause or restate your limits.",
    "Track what you have already given to avoid drift."
  ],
  "rationale": "",
  "applicability": {
    "domains": [
      "GENERAL",
      "RENT_HOUSING",
      "PROCUREMENT_VENDOR",
      "JOB_OFFER_COMP",
      "SERVICES_CONTRACTOR",
      "PERSONAL_FAMILY"
    ],
    "channels": [
      "EMAIL",
      "DM",
      "IN_PERSON_NOTES"
    ],
    "when_to_use": [
      "Use when you need a structured move to progress the negotiation."
    ],
    "when_not_to_use": [
      "Avoid when facts are missing and you need intake/clarification first."
    ],
    "prerequisites": [
      {
        "id": "PREREQ_HAS_OBJECTIVES",
        "description": "Case objectives exist (target/acceptable/walk-away).",
        "condition": {
          "type": "PREDICATE",
          "predicate": {
            "op": "EXISTS",
            "path": "/objectives/target"
          }
        },
        "severity": "WARNING",
        "remediation": "Fill target/acceptable/walk-away in the Strategy Canvas."
      }
    ]
  },
  "inputs": [
    {
      "key": "concession_item",
      "label": "Concession you might give",
      "type": "STRING",
      "required": true
    },
    {
      "key": "request_in_return",
      "label": "What you want in return",
      "type": "STRING",
      "required": true
    }
  ],
  "steps": [
    {
      "step_id": "STEP_VALIDATE",
      "title": "Validate context and prerequisites",
      "instruction": "Validate prerequisites, restate the intended move, and identify missing info that would improve execution.",
      "agent_actions": [
        {
          "action": "Load case snapshot",
          "tool": "RETRIEVE_CASE",
          "output_key": "case"
        }
      ],
      "outputs": [
        "PLAN_PATCH"
      ],
      "notes": "If blockers exist, return remediation instead of artifacts."
    },
    {
      "step_id": "STEP_EXECUTE",
      "title": "Execute the strategy",
      "instruction": "Generate the required artifacts (drafts, packages, checklist) and run critique rubrics before presenting to the user.",
      "agent_actions": [
        {
          "action": "Generate message drafts",
          "tool": "GENERATE_MESSAGE_DRAFTS",
          "output_key": "drafts"
        },
        {
          "action": "Critique drafts",
          "tool": "CRITIQUE_MESSAGE",
          "output_key": "judge"
        }
      ],
      "outputs": [
        "MESSAGE_DRAFTS",
        "DECISION_LOG"
      ]
    }
  ],
  "scripts": {
    "snippets": [],
    "templates": []
  },
  "branches": [
    {
      "branch_id": "BRANCH_THEY_ASK_MORE",
      "label": "They ask for another concession",
      "trigger": {
        "type": "PREDICATE",
        "predicate": {
          "op": "CONTAINS",
          "path": "/timeline/recent_events/0/raw_text",
          "value": "also"
        }
      },
      "recommended_move": {
        "move_type": "ASK_QUESTION",
        "instruction": "Ask which priority they\u2019re solving for and propose a single trade: 'If I do X, can we agree on Y?'"
      },
      "outputs": [
        "MESSAGE_DRAFTS",
        "PLAN_PATCH"
      ],
      "risk_notes": "Do not stack concessions without reciprocation."
    }
  ],
  "evaluation": {
    "rubric_ids": [
      "RUBRIC_MESSAGE_QUALITY",
      "RUBRIC_NEGOTIATION_SAFETY"
    ],
    "success_criteria": [
      "Move is explicit and progresses the negotiation.",
      "Message includes a next step or calibrated question."
    ],
    "failure_modes": [
      "Vague ask.",
      "Unnecessary disclosure of urgency or bottom line."
    ],
    "do_not_do": [
      "Do not fabricate facts.",
      "Do not reveal your bottom line unless intentionally walking away."
    ],
    "auto_gates": [
      {
        "gate_id": "GATE_BOTTOM_LINE_LANGUAGE",
        "description": "Warn or block if explicit bottom line language is present.",
        "condition": {
          "type": "PREDICATE",
          "predicate": {
            "op": "MATCHES",
            "path": "/execution_context/draft_text",
            "regex": "(minimum|bottom line|final offer)"
          }
        },
        "severity": "WARN"
      }
    ]
  },
  "ui": {
    "card_title": "Concession discipline (trade, don\u2019t give)",
    "card_summary": "Ensure every concession is exchanged for something of value and logged in the concession ledger to prevent gradual squeeze.",
    "primary_cta": "Run strategy",
    "secondary_ctas": [
      "Edit plan",
      "Generate variants"
    ],
    "icon": "sparkles"
  },
  "references": []
}
