{
  "strategy_id": "STRAT_INTRODUCE_NEW_ISSUE",
  "revision": 1,
  "name": "Introduce a new issue to create trade space",
  "category": "VALUE_CREATE",
  "subcategories": [],
  "tags": [
    "UNBUNDLE",
    "TRADEOFFS",
    "PACKAGING"
  ],
  "summary": "Add a new negotiable issue (timing, risk, scope, service level) to enable value-creating trades when stuck on one point.",
  "goal": "Unlock agreement by creating more degrees of freedom.",
  "counterparty_guidance": [
    "Assess scope creep and ask why the issue appears now.",
    "Decide whether to bundle, park, or trade for the new issue.",
    "If accepted, link it to a concession from their side.",
    "Avoid expanding the deal without protection."
  ],
  "rationale": "",
  "applicability": {
    "domains": [
      "GENERAL",
      "RENT_HOUSING",
      "PROCUREMENT_VENDOR",
      "JOB_OFFER_COMP",
      "SERVICES_CONTRACTOR",
      "PERSONAL_FAMILY"
    ],
    "channels": [
      "EMAIL",
      "DM",
      "IN_PERSON_NOTES"
    ],
    "when_to_use": [
      "Use when you need a structured move to progress the negotiation."
    ],
    "when_not_to_use": [
      "Avoid when facts are missing and you need intake/clarification first."
    ],
    "prerequisites": [
      {
        "id": "PREREQ_HAS_OBJECTIVES",
        "description": "Case objectives exist (target/acceptable/walk-away).",
        "condition": {
          "type": "PREDICATE",
          "predicate": {
            "op": "EXISTS",
            "path": "/objectives/target"
          }
        },
        "severity": "WARNING",
        "remediation": "Fill target/acceptable/walk-away in the Strategy Canvas."
      }
    ]
  },
  "inputs": [
    {
      "key": "new_issue",
      "label": "New issue to introduce",
      "type": "STRING",
      "required": true
    },
    {
      "key": "why_it_matters",
      "label": "Why it matters to them",
      "type": "STRING",
      "required": false
    }
  ],
  "steps": [
    {
      "step_id": "STEP_VALIDATE",
      "title": "Validate context and prerequisites",
      "instruction": "Validate prerequisites, restate the intended move, and identify missing info that would improve execution.",
      "agent_actions": [
        {
          "action": "Load case snapshot",
          "tool": "RETRIEVE_CASE",
          "output_key": "case"
        }
      ],
      "outputs": [
        "PLAN_PATCH"
      ],
      "notes": "If blockers exist, return remediation instead of artifacts."
    },
    {
      "step_id": "STEP_EXECUTE",
      "title": "Execute the strategy",
      "instruction": "Generate the required artifacts (drafts, packages, checklist) and run critique rubrics before presenting to the user.",
      "agent_actions": [
        {
          "action": "Generate message drafts",
          "tool": "GENERATE_MESSAGE_DRAFTS",
          "output_key": "drafts"
        },
        {
          "action": "Critique drafts",
          "tool": "CRITIQUE_MESSAGE",
          "output_key": "judge"
        }
      ],
      "outputs": [
        "MESSAGE_DRAFTS",
        "DECISION_LOG"
      ]
    }
  ],
  "scripts": {
    "snippets": [],
    "templates": []
  },
  "branches": [
    {
      "branch_id": "BRANCH_THEY_SAY_ONLY_PRICE",
      "label": "They insist only the main term matters",
      "trigger": {
        "type": "PREDICATE",
        "predicate": {
          "op": "CONTAINS",
          "path": "/timeline/recent_events/0/raw_text",
          "value": "only"
        }
      },
      "recommended_move": {
        "move_type": "ASK_QUESTION",
        "instruction": "Ask what they are optimizing for (speed, certainty, risk) and propose the new issue as a way to meet that priority."
      },
      "outputs": [
        "MESSAGE_DRAFTS",
        "PLAN_PATCH"
      ],
      "risk_notes": "Keep it simple; don\u2019t add complexity without rationale."
    }
  ],
  "evaluation": {
    "rubric_ids": [
      "RUBRIC_MESSAGE_QUALITY",
      "RUBRIC_NEGOTIATION_SAFETY"
    ],
    "success_criteria": [
      "Move is explicit and progresses the negotiation.",
      "Message includes a next step or calibrated question."
    ],
    "failure_modes": [
      "Vague ask.",
      "Unnecessary disclosure of urgency or bottom line."
    ],
    "do_not_do": [
      "Do not fabricate facts.",
      "Do not reveal your bottom line unless intentionally walking away."
    ],
    "auto_gates": [
      {
        "gate_id": "GATE_BOTTOM_LINE_LANGUAGE",
        "description": "Warn or block if explicit bottom line language is present.",
        "condition": {
          "type": "PREDICATE",
          "predicate": {
            "op": "MATCHES",
            "path": "/execution_context/draft_text",
            "regex": "(minimum|bottom line|final offer)"
          }
        },
        "severity": "WARN"
      }
    ]
  },
  "ui": {
    "card_title": "Introduce a new issue to create trade space",
    "card_summary": "Add a new negotiable issue (timing, risk, scope, service level) to enable value-creating trades when stuck on one point.",
    "primary_cta": "Run strategy",
    "secondary_ctas": [
      "Edit plan",
      "Generate variants"
    ],
    "icon": "sparkles"
  },
  "references": []
}
