{
  "strategy_id": "STRAT_LABEL_EMOTIONS",
  "revision": 1,
  "name": "Label emotions (tactical empathy)",
  "category": "COMMUNICATION",
  "subcategories": [],
  "tags": [
    "LABELING",
    "EMPATHY",
    "EMAIL",
    "DM"
  ],
  "summary": "Name the emotion or pressure you think they\u2019re experiencing to lower defensiveness and invite correction.",
  "goal": "Improve rapport and unlock information by making them feel understood.",
  "counterparty_guidance": [
    "Acknowledge the feeling without accepting blame.",
    "Clarify facts and keep the conversation grounded.",
    "Use empathy to lower tension, then return to issues.",
    "Avoid being steered by emotional framing alone."
  ],
  "rationale": "",
  "applicability": {
    "domains": [
      "GENERAL",
      "RENT_HOUSING",
      "PROCUREMENT_VENDOR",
      "JOB_OFFER_COMP",
      "SERVICES_CONTRACTOR",
      "PERSONAL_FAMILY"
    ],
    "channels": [
      "EMAIL",
      "DM",
      "IN_PERSON_NOTES"
    ],
    "when_to_use": [
      "Use when you need a structured move to progress the negotiation."
    ],
    "when_not_to_use": [
      "Avoid when facts are missing and you need intake/clarification first."
    ],
    "prerequisites": [
      {
        "id": "PREREQ_HAS_OBJECTIVES",
        "description": "Case objectives exist (target/acceptable/walk-away).",
        "condition": {
          "type": "PREDICATE",
          "predicate": {
            "op": "EXISTS",
            "path": "/objectives/target"
          }
        },
        "severity": "WARNING",
        "remediation": "Fill target/acceptable/walk-away in the Strategy Canvas."
      }
    ]
  },
  "inputs": [
    {
      "key": "emotion_guess",
      "label": "Emotion/pressure to label",
      "type": "STRING",
      "required": true
    }
  ],
  "steps": [
    {
      "step_id": "STEP_VALIDATE",
      "title": "Validate context and prerequisites",
      "instruction": "Validate prerequisites, restate the intended move, and identify missing info that would improve execution.",
      "agent_actions": [
        {
          "action": "Load case snapshot",
          "tool": "RETRIEVE_CASE",
          "output_key": "case"
        }
      ],
      "outputs": [
        "PLAN_PATCH"
      ],
      "notes": "If blockers exist, return remediation instead of artifacts."
    },
    {
      "step_id": "STEP_EXECUTE",
      "title": "Execute the strategy",
      "instruction": "Generate the required artifacts (drafts, packages, checklist) and run critique rubrics before presenting to the user.",
      "agent_actions": [
        {
          "action": "Generate message drafts",
          "tool": "GENERATE_MESSAGE_DRAFTS",
          "output_key": "drafts"
        },
        {
          "action": "Critique drafts",
          "tool": "CRITIQUE_MESSAGE",
          "output_key": "judge"
        }
      ],
      "outputs": [
        "MESSAGE_DRAFTS",
        "DECISION_LOG"
      ]
    }
  ],
  "scripts": {
    "snippets": [],
    "templates": []
  },
  "branches": [
    {
      "branch_id": "BRANCH_POLICY_WALL",
      "label": "They cite policy, budget, or fixed constraints",
      "trigger": {
        "type": "ANY",
        "any": [
          {
            "type": "PREDICATE",
            "predicate": {
              "op": "CONTAINS",
              "path": "/timeline/recent_events/0/raw_text",
              "value": "policy"
            }
          },
          {
            "type": "PREDICATE",
            "predicate": {
              "op": "CONTAINS",
              "path": "/timeline/recent_events/0/raw_text",
              "value": "budget"
            }
          }
        ]
      },
      "recommended_move": {
        "move_type": "ASK_QUESTION",
        "instruction": "Acknowledge the constraint and ask what flexibility exists (other issues, timing, structure) before proposing a new trade-off."
      },
      "outputs": [
        "MESSAGE_DRAFTS",
        "CHECKLIST"
      ],
      "risk_notes": "Avoid arguing; pivot to constraints and options."
    }
  ],
  "evaluation": {
    "rubric_ids": [
      "RUBRIC_MESSAGE_QUALITY",
      "RUBRIC_NEGOTIATION_SAFETY"
    ],
    "success_criteria": [
      "Move is explicit and progresses the negotiation.",
      "Message includes a next step or calibrated question."
    ],
    "failure_modes": [
      "Vague ask.",
      "Unnecessary disclosure of urgency or bottom line."
    ],
    "do_not_do": [
      "Do not fabricate facts.",
      "Do not reveal your bottom line unless intentionally walking away."
    ],
    "auto_gates": [
      {
        "gate_id": "GATE_BOTTOM_LINE_LANGUAGE",
        "description": "Warn or block if explicit bottom line language is present.",
        "condition": {
          "type": "PREDICATE",
          "predicate": {
            "op": "MATCHES",
            "path": "/execution_context/draft_text",
            "regex": "(minimum|bottom line|final offer)"
          }
        },
        "severity": "WARN"
      }
    ]
  },
  "ui": {
    "card_title": "Label emotions (tactical empathy)",
    "card_summary": "Name the emotion or pressure you think they\u2019re experiencing to lower defensiveness and invite correction.",
    "primary_cta": "Run strategy",
    "secondary_ctas": [
      "Edit plan",
      "Generate variants"
    ],
    "icon": "sparkles"
  },
  "references": []
}
